{
  "datetime": "2015-01-03",
  "ts": 1501970516,
  "revision_status": "final",
  "slp": 1020.1,
  "pres": 885.1,
  "rh": 85.0,
  "dewpt": -1.5,
  "temp": 1.0,
  "max_temp": 1.5,
  "max_temp_ts": 1501970816,
  "min_temp": 11.7,
  "min_temp_ts": 1501970516,
  "wind_spd": 14.98,
  "wind_dir": 325,
  "wind_gust_spd": 40.98,
  "max_wind_spd": 19.98,
  "max_wind_dir": 325,
  "max_wind_spd_ts": 1501970516,
  "ghi": 125,
  "t_ghi": 4500,
  "dni": 125,
  "t_dni": 4500,
  "dhi": 125,
  "t_dhi": 4500,
  "max_uv": 6.0,
  "precip": 3.0,
  "precip_gpm": 3.0,
  "snow": 30.0
}